{
  "status": "completed",
  "phase": "execute_task",
  "runner": "claude",
  "issue_number": 200,
  "scope_summary": "Implemented the runner-neutral task-executor phase contract under .red/contracts/ with a schema, validator, fixtures, and a CI hook. No /afk runtime changes; no commit/merge behavior moved into the executor.",
  "non_goals": [
    "Wire /afk to invoke the executor or consume its envelope",
    "Add a Claude Code packaged sub-agent under plugins/dev/agents/",
    "Modify the existing afk-task or issue-analyzer schemas or fixtures",
    "Move commit/merge behavior into the executor"
  ],
  "acceptance_criteria_results": [
    {
      "criterion": "The executor contract references existing AFK issue/handoff concepts and preserves issue-native execution.",
      "result": "unverified",
      "evidence": "Inputs section of task-executor.md references issue body, handoff, previous attempts, human guidance, and recent commits only."
    },
    {
      "criterion": "The contract defines structured success, blocked, and escalation outputs compatible with #205.",
      "result": "unverified",
      "evidence": "task-executor.schema.json extends the base envelope from afk-task.schema.json with status enum {completed, blocked, escalation_needed} and conditional blocked/escalation requirements."
    },
    {
      "criterion": "The executor scope rules prevent out-of-scope file changes and explain when to escalate.",
      "result": "unverified",
      "evidence": "Scope rules and 'When to escalate vs block' sections of task-executor.md."
    },
    {
      "criterion": "The executor requires explicit acceptance-criteria tracking and non-goal preservation.",
      "result": "unverified",
      "evidence": "execution.changes_by_criterion and execution.non_goals_preserved are required in the schema."
    },
    {
      "criterion": "Fixture coverage validates parsing of executor outputs, including malformed or incomplete output.",
      "result": "unverified",
      "evidence": "5 fixtures under .red/contracts/fixtures/task-executor/ covering valid completed, valid escalation, missing-execution, malformed-json, completed-without-changes."
    },
    {
      "criterion": "No commit/merge behavior is moved into the executor; quality and commit remain owned by later phases.",
      "result": "unverified",
      "evidence": "Schema forces verification_commands/verification_results/quality_gate_failures to be empty; task-executor.md scope rule 1 forbids commit/merge."
    },
    {
      "criterion": "The same executor contract can be rendered for Claude Code native agents and Codex phased execution.",
      "result": "unverified",
      "evidence": "Per-runner emission notes describe Claude Code sub-agent packaging and Codex inline-phase emission of the same envelope."
    }
  ],
  "changed_files": [
    ".red/contracts/task-executor.md",
    ".red/contracts/task-executor.schema.json",
    ".red/contracts/fixtures/task-executor/valid/normal-implementation.json",
    ".red/contracts/fixtures/task-executor/valid/blocked-out-of-scope.json",
    ".red/contracts/fixtures/task-executor/invalid/missing-execution.json",
    ".red/contracts/fixtures/task-executor/invalid/malformed-json.json",
    ".red/contracts/fixtures/task-executor/invalid/completed-without-changes.json",
    "scripts/validate-task-executor-contract.sh",
    "scripts/test-validate-task-executor-contract.sh",
    ".github/workflows/red-release.yml",
    "CHANGES.md"
  ],
  "verification_commands": [],
  "verification_results": [],
  "quality_gate_failures": [],
  "blocker_reason": null,
  "next_human_action": null,
  "remaining_risks": [
    "Downstream PRD #196 slices may discover the execution shape needs fields beyond this minimal cut.",
    "Executor implementations on Codex (inlined) may emit subtly different envelopes than the Claude Code sub-agent until #199-#202 production wiring lands."
  ],
  "confidence": "high",
  "raw_runner_output_path": null,
  "execution": {
    "implementation_summary": "Added .red/contracts/task-executor.md (canonical phase contract) and task-executor.schema.json (draft 2020-12 with closed envelope + execution object, conditional requirements for completed/blocked/escalation_needed). Added a jq-only validator and a fixture-driven test wired into red-release.yml, plus 5 fixtures spanning happy path, escalation, and three failure modes. CHANGES.md records the addition.",
    "changes_by_criterion": [
      {
        "criterion": "The executor contract references existing AFK issue/handoff concepts and preserves issue-native execution.",
        "files_touched": [".red/contracts/task-executor.md"],
        "approach": "Document Inputs as the issue body + handoff elements + previous attempts + human guidance + analyzer envelope, and explicitly forbid creating a new docs/plans/tasks queue.",
        "status": "implemented"
      },
      {
        "criterion": "The contract defines structured success, blocked, and escalation outputs compatible with #205.",
        "files_touched": [".red/contracts/task-executor.md", ".red/contracts/task-executor.schema.json"],
        "approach": "Extend the base envelope with phase=const execute_task, keep the status enum identical, and reuse the conditional blocked/escalation requirements from afk-task.schema.json.",
        "status": "implemented"
      },
      {
        "criterion": "The executor scope rules prevent out-of-scope file changes and explain when to escalate.",
        "files_touched": [".red/contracts/task-executor.md", ".red/contracts/task-executor.schema.json", "scripts/validate-task-executor-contract.sh"],
        "approach": "Add Scope rules (no commit, no quality gates, no out-of-scope writes, no new queues), encode the execute-phase invariants in the schema, and have the validator enforce empty verification arrays and the subset-rule on files_touched.",
        "status": "implemented"
      },
      {
        "criterion": "The executor requires explicit acceptance-criteria tracking and non-goal preservation.",
        "files_touched": [".red/contracts/task-executor.schema.json", "scripts/validate-task-executor-contract.sh"],
        "approach": "Require execution.changes_by_criterion (one entry per acceptance criterion with files_touched + approach + status) and execution.non_goals_preserved in the schema; validator rejects missing or malformed entries.",
        "status": "implemented"
      },
      {
        "criterion": "Fixture coverage validates parsing of executor outputs, including malformed or incomplete output.",
        "files_touched": [
          ".red/contracts/fixtures/task-executor/valid/normal-implementation.json",
          ".red/contracts/fixtures/task-executor/valid/blocked-out-of-scope.json",
          ".red/contracts/fixtures/task-executor/invalid/missing-execution.json",
          ".red/contracts/fixtures/task-executor/invalid/malformed-json.json",
          ".red/contracts/fixtures/task-executor/invalid/completed-without-changes.json",
          "scripts/test-validate-task-executor-contract.sh"
        ],
        "approach": "Two valid fixtures (happy path and escalation) plus three negative fixtures (missing execution object, malformed JSON, completed with no changed_files); fixture runner asserts expected outcomes and key error fragments.",
        "status": "implemented"
      },
      {
        "criterion": "No commit/merge behavior is moved into the executor; quality and commit remain owned by later phases.",
        "files_touched": [".red/contracts/task-executor.md", ".red/contracts/task-executor.schema.json", "scripts/validate-task-executor-contract.sh"],
        "approach": "Schema forces verification_commands/verification_results/quality_gate_failures to be empty arrays; doc Scope rule 1 forbids commit/merge; doc Status of this contract section reiterates /afk continues to use the existing sentinels.",
        "status": "implemented"
      },
      {
        "criterion": "The same executor contract can be rendered for Claude Code native agents and Codex phased execution.",
        "files_touched": [".red/contracts/task-executor.md"],
        "approach": "Per-runner emission section describes the Claude Code sub-agent packaging path and the Codex inlined-phase path emitting the same envelope, mirroring the issue-analyzer pattern; public copy avoids the 'Codex sub-agent' label per #204 §4.",
        "status": "implemented"
      }
    ],
    "out_of_scope_rejections": [],
    "non_goals_preserved": [
      "Did not wire /afk to invoke the executor or consume its envelope",
      "Did not add or modify any files under plugins/dev/agents/ or plugins/dev/skills/engineering/afk/",
      "Did not edit afk-task or issue-analyzer schemas, validators, or fixtures"
    ],
    "commit_hint": {
      "subject": "feat(contracts): #200 add task-executor phase contract",
      "body": "Minimal runner-neutral execute_task phase contract built on top of the #205 envelope. Specialises the base AFK task envelope with an `execution` object and enforces the execute-phase invariants (no quality gates, no commits, all acceptance results unverified, completed requires non-empty changed_files and all changes_by_criterion implemented).\n\nDocumentation/contract-only: /afk is not rewired to invoke the executor or consume its envelope. Production wiring is deferred to later PRD #196 slices. Codex emission is described as an inlined phase per #204 §4.\n\nRefs #200"
    },
    "escalation_triggers": [],
    "follow_ups": [
      "Package the executor as plugins/dev/agents/task-executor.md once #198 lands the agent-metadata validator wiring for new agents.",
      "Wire /afk to extract and validate the executor envelope alongside the analyzer envelope in the production slice."
    ]
  }
}
