{
  "status": "escalation_needed",
  "phase": "execute_task",
  "runner": "claude",
  "issue_number": 9998,
  "scope_summary": "Started implementing the brief but a late human-guidance comment asked the executor to also delete a marketplace.json entry. That file is outside the analyzer's scope_boundaries and removing it would affect every consumer of the plugin, so the executor declined and is asking /afk to re-route the request.",
  "non_goals": [
    "Delete or rewrite the marketplace.json entry",
    "Refactor adjacent plugins while editing the in-scope skill"
  ],
  "acceptance_criteria_results": [
    {
      "criterion": "The new skill is added under plugins/dev/skills/engineering/example/.",
      "result": "unverified",
      "evidence": "Initial scaffolding created at plugins/dev/skills/engineering/example/SKILL.md before the executor stopped."
    },
    {
      "criterion": "The skill is listed in the dev plugin manifest.",
      "result": "unverified",
      "evidence": "Deferred — manifest edit was queued behind the marketplace.json question."
    }
  ],
  "changed_files": [
    "plugins/dev/skills/engineering/example/SKILL.md"
  ],
  "verification_commands": [],
  "verification_results": [],
  "quality_gate_failures": [],
  "blocker_reason": null,
  "next_human_action": "Confirm whether the marketplace.json deletion is in scope for this issue. If yes, re-triage as a separate slice; if no, retract the guidance comment and re-queue with priority:normal so the executor can finish the original brief.",
  "remaining_risks": [
    "The partial SKILL.md scaffold under plugins/dev/skills/engineering/example/ will be left on the worktree until the orchestrator merges or discards the attempt."
  ],
  "confidence": "high",
  "raw_runner_output_path": null,
  "execution": {
    "implementation_summary": "Created the initial SKILL.md scaffold for the new example skill and stopped before editing the plugin manifest. Declined the human-guidance ask to delete a marketplace.json entry because it falls outside the analyzer's scope_boundaries and would affect every consumer of the dev plugin.",
    "changes_by_criterion": [
      {
        "criterion": "The new skill is added under plugins/dev/skills/engineering/example/.",
        "files_touched": ["plugins/dev/skills/engineering/example/SKILL.md"],
        "approach": "Scaffolded the SKILL.md with frontmatter and an empty <what-to-do> body matching the conventions in neighbouring skills.",
        "status": "partial"
      },
      {
        "criterion": "The skill is listed in the dev plugin manifest.",
        "files_touched": [],
        "approach": "Deferred until the marketplace.json scope question is resolved by a human.",
        "status": "deferred"
      }
    ],
    "out_of_scope_rejections": [
      {
        "requested_change": "Delete the dev plugin entry from .claude-plugin/marketplace.json so the new skill is the only listing.",
        "reason": "Outside the analyzer's scope_boundaries (only files under plugins/dev/skills/engineering/example/ and the dev plugin manifest were in scope). Removing a marketplace entry affects every consumer of the dev plugin and should be a separately-triaged slice."
      }
    ],
    "non_goals_preserved": [
      "Did not delete or rewrite the marketplace.json entry",
      "Did not touch other skills' SKILL.md or READMEs"
    ],
    "commit_hint": null,
    "escalation_triggers": [
      "out_of_scope_request_unavoidable",
      "human_guidance_conflicts_with_analyzer_scope"
    ],
    "follow_ups": [
      "If the marketplace.json change is wanted, file a separate issue with its own triage; do not bundle it into this slice."
    ]
  }
}
